Sorszám;Megye;Járás;Járáshoz tartozó települések
132.;;Marcali;Balatonberény, Balatonszentgyörgy, Balatonújlak, Böhönye, Csákány, Csömend, Főnyed, Gadány, Hollád, Hosszúvíz, Kelevíz, Kéthely, Libickozma, Marcali, Mesztegnyő, Nagyszakácsi, Nemesdéd, Nemeskisfalud, Nemesvid, Nikla, Pusztakovácsi, Sávoly, Somogyfajsz, Somogysámson, Somogysimonyi, Somogyszentpál, Somogyzsitfa, Szegerdő, Szenyér, Szőkedencs, Tapsony, Táska, Tikos, Varászló, Vése, Vörs
133.;;Nagyatád;Bakháza, Beleg, Bolhás, Görgeteg, Háromfa, Kaszó, Kisbajom, Kutas, Lábod, Mike, Nagyatád, Nagykorpád, Ötvöskónyi, Rinyabesenyő, Rinyaszentkirály, Rinyaújnép, Segesd, Somogyszob, Szabás, Tarany
134.;;Siófok;Ádánd, Balatonendréd, Balatonföldvár, Balatonszabadi, Balatonszárszó, Bálványos, Kőröshegy, Nagyberény, Nyim, Ságvár, Siófok, Siójut, Som, Szántód, Zamárdi
135.;;Tab;Andocs, Bábonymegyer, Bedegkér, Bonnya, Fiad, Kánya, Kapoly, Kára, Karád, Kereki, Kisbárapáti, Lulla, Miklósi, Nágocs, Pusztaszemes, Sérsekszőlős, Somogyacsa, Somogydöröcske, Somogyegres, Somogymeggyes, Szorosad, Tab, Tengőd, Torvaj, Törökkoppány, Zala, Zics
136.;Szabolcs-Szatmár-Bereg;Baktalórántháza;Baktalórántháza, Besenyőd, Laskod, Levelek, Magy, Nyíribrony, Nyírjákó, Nyírkércs, Ófehértó ,Petneháza, Ramocsaháza, Rohod
137.;;Csenger;"Csenger,Csengersima,Csengerújfalu,Komlódtótfalu, Pátyod,Porcsalma, Szamosangyalos, Szamosbecs
Szamostatárfalva, Tyukod, Ura"
138.;;Fehérgyarmat;"Botpalád, Cégénydányád, Csaholc, Császló, Csegöld, Darnó, Fehérgyarmat, Fülesd, Gacsály, Garbolc, Gyügye, Hermánszeg, Jánkmajtis, Kérsemjén, Kisar, Kishódos, Kisnamény, Kispalád, Kisszekeres, Kölcse, Kömörő, Magosliget, Mánd, Méhtelek, Milota, Nábrád, Nagyar, Nagyhódos, Nagyszekeres, Nemesborzova, Olcsvaapáti, Panyola, Penyige, Rozsály, 
Sonkád, Szamoskér, Szamossályi, Szamosújlak, Szatmárcseke, Tarpa, Tiszabecs, Tiszacsécse, Tiszakóród, Tisztaberek, Tivadar, Tunyogmatolcs, Túristvándi, Túrricse, Uszka, Vámosoroszi, Zajta, Zsarolyán"
139.;;Kisvárda;Ajak, Anarcs, Dombrád, Döge, Fényeslitke, Gyulaháza, Jéke, Kékcse, Kisvárda, Lövőpetri, Mezőladány, Nyírkarász, Nyírlövő, Nyírtass, Pap,Pátroha, Rétközberencs, Szabolcsbáka, Szabolcsveresmart, Tiszakanyár, Tornyospálca, Újdombrád, Újkenéz
140.;;Mátészalka;Fábiánháza, Fülpösdaróc, Géberjén, Győrtelek, Hodász, Jármi, Kántorjánosi, Kocsord, Mátészalka, Mérk, Nagydobos, Nagyecsed,, Nyírcsaholy, Nyírkáta, Nyírmeggyes, Nyírparasznya, Ópályi, Ököritófülpös, Őr, Papos, Rápolt, Szamosszeg, Tiborszállás, Vaja, Vállaj
141.;;Nagykálló;Balkány, Biri, Bököny, Érpatak, Geszteréd, Kállósemjén, Nagykálló, Szakoly
142.;;Nyírbátor;Bátorliget, Encsencs, Kisléta, Máriapócs, Nyírbátor, Nyírbéltek, Nyírbogát, Nyírcsászári, Nyírderzs, Nyírgelse, Nyírgyulaj, Nyírlugos, Nyírmihálydi, Nyírpilis, Nyírvasvári, Ömböly, Penészlek, Piricse, Pócspetri, Terem
143.;;Nyíregyháza;Apagy, Balsa, Buj, Gávavencsellő,  Ibrány, Kálmánháza,  Kótaj, Nagycserkesz, Nagyhalász, Napkor,  Nyíregyháza, Nyírpazony, Nyírtelek, Nyírtét, Nyírtura, Paszab, Rakamaz, Sényő, Szabolcs,  Timár, Tiszabercel, Tiszanagyfalu,  Tiszatelek, Újfehértó, Apagy, Balsa, 
144.;;Kemecse; Berkesz, Beszterec, Demecser, Gégény, Kemecse, Kék, Nyírbogdány, Székely, Tiszarád, Vasmegyer
145.;;Tiszavasvári;Szorgalmatos, Tiszadada, Tiszadob, Tiszaeszlár, Tiszalök, Tiszavasvári
146.;;Vásárosnamény;Aranyosapáti, Barabás, Beregdaróc, Beregsurány, Csaroda, Gelénes, Gemzse, Gulács, Gyüre, Hetefejércse, Ilk, Jánd, Kisvarsány, Lónya, Márokpapi, Mátyus, Nagyvarsány, Nyírmada, Olcsva, Pusztadobos, Tákos, Tiszaadony, Tiszakerecseny, Tiszaszalka, Tiszavid, Vámosatya, Vásárosnamény
147.;;Záhony;Benk, Eperjeske, Győröcske, Komoró, Mándok, Tiszabezdéd, Tiszamogyorós, Tiszaszentmárton, Tuzsér, Záhony, Zsurk
148.;Tolna;Bonyhád;Aparhant, Bátaapáti, Bonyhád, Bonyhádvarasd, Cikó, Felsőnána, Grábóc, Györe, Izmény,Kakasd, Kéty, Kisdorog, Kismányok, Kisvejke, Lengyel, Mórágy, Mőcsény, Mucsfa, Murga, Nagymányok, Nagyvejke, Tevel, Váralja, Závod, Zomba
149.;;Dombóvár;Attala, Csibrák, Csikóstőttős, Dalmand, Dombóvár, Döbrököz, Gyulaj, Jágónak, Kapospula, Kaposszekcső, Kocsola, Kurd, Lápafő, Nak, Szakcs, Várong
150.;;Paks;Bikács, Bölcske, Dunaföldvár,  Györköny, Kajdacs, Madocsa, Nagydorog, Németkér, Paks, Pálfa, Pusztahencse, Sárszentlőrinc
151.;;Szekszárd;Alsónána, Alsónyék, Báta, Bátaszék,Decs,     Őcsény, Pörböly, Sárpilis, Szálka,  Szekszárd,   Várdomb
152.;;Tamási;Belecska, Diósberény, Dúzs, Értény, Felsőnyék, Fürged, Gyönk, Hőgyész, Iregszemcse, Kalaznó, Keszőhidegkút, Kisszékely, Koppányszántó, Magyarkeszi, Miszla, Mucsi, Nagykónyi, Nagyszékely, Nagyszokoly, Ozora, Pári, Pincehely, Regöly, Simontornya, Szakadát, Szakály, Szárazd, Tamási, Tolnanémedi, Udvari, Újireg, Varsád
153.;;Tolna;Bogyiszló, Dunaszentgyörgy, Fácánkert, Fadd, Gerjen,  Harc,  Kölesd, Kistormás, Medina, Sioagárd, Szedres, Tengelic, Tolna
154.;Vas;Celldömölk;Boba, Borgáta, Celldömölk, Csönge, Duka, Egyházashetye, Jánosháza, Karakó, Keléd, Kemeneskápolna, Kemenesmagasi, Kemenesmihályfa, Kemenespálfa, Kemenessömjén, Kemenesszentmárton, Kenyeri, Kissomlyó, Köcsk, Mersevát, Mesteri, Nagysimonyi, Nemeskeresztúr, Nemeskocs, Ostffyasszonyfa, Pápoc, Szergény, Tokorcs, Vönöck
155.;;Körmend;Csákánydoroszló, Daraboshegy, Döbörhegy, Döröske, Egyházashollós, Egyházasrádóc, Felsőjánosfa, Felsőmarác, Halastó, Halogy, Harasztifalu, Hegyháthodász, Hegyhátsál, Hegyhátszentjakab, Hegyhátszentmárton, Ivánc, Katafa, Kemestaródfa, Kisrákos, Körmend, Magyarnádalja, Magyarszecsőd, Molnaszecsőd, Nádasd, Nagykölked, Nagymizdó, Nemesrempehollós, Őrimagyarósd, Pankasz, Pinkamindszent, Rádóckölked, Szaknyér, Szarvaskend, Szőce, Vasalja, Viszák     
156.;;Kőszeg;Bozsok, Bük, Cák, Csepreg, Horvátzsidány, Iklanberény, Kiszsidány, Kőszeg, Kőszegdoroszló, Kőszegpaty, Kőszegszerdahely, Lócs, Lukácsháza, Nemescsó, Ólmod, Peresznye, Pusztacsó, Tormásliget, Velem
157.;;Sárvár;Bejcgyertyános, Bő, Bögöt, Bögöte, Chernelházadamonya, Csánig, Csénye, Egervölgy, Gérce, Gór, Hegyfalu, Hosszúpereszteg, Ikervár, Jákfa, Káld, Megyehíd, Meggyeskovácsi, Mesterháza, Nagygeresd, Nemesládony, Nick, Nyőgér, Ölbő, Porpác, Pósfa, Rábapaty, Répcelak, Répceszentgyörgy, Sajtoskál, Sárvár, Simaság, Sitke, Sótony, Szeleste, Tompaládony, Uraiújfalu, Vámoscsalád, Vásárosmiske, Vasegerszeg, Vashosszúfalu, Zsédeny
158.;;Szentgotthárd;Alsószölnök, Apátistvánfalva, Bajánsenye, Csörötnek, Felsőszölnök, Gasztony, Ispánk, Kercaszomor, Kerkáskápolna, Kétvölgy, Kondorfa, Magyarlak, Magyarszombatfa, Nagyrákos, Nemesmedves, Orfalu, Őriszentpéter, Rábagyarmat, Rátót, Rönök, Szakonyfalu, Szalafő, Szatta, Szentgotthárd, Vasszentmihály, Velemér
159.;;Szombathely;Acsád, Balogunyom, Bozzai, Bucsu, Csempeszkopács, Dozmat, Felsőcsatár, Gencsapáti, Gyanógeregye, Gyöngyösfalu, Horvátlövő, Ják, Kenéz, Kisunyom, Meszlen, Nárai, Narda, Nemesbőd, Nemeskolta, Pecöl, Perenye, Pornóapáti, Rábatöttös, Rum, Salköveskút, Sé, Sorkifalud, Sorkikápolna, Sorokpolány, Söpte, Szentpéterfa, Szombathely, Tanakajd, Táplánszentkereszt, Torony, Tömörd, Vasasszonyfa, Vaskeresztes, Vassurány, Vasszécseny, Vasszilvágy, Vát, Vép, Zsennye
160.;;Vasvár;Alsóújlak, Andrásfa, Bérbaltavár, Csehi, Csehimindszent, Csipkerek, Gersekarát, Győrvár, Hegyhátszentpéter, Kám, Mikosszéplak, Nagytilaj, Olaszfa, Oszkó, Pácsony, Petőmihályfa, Püspökmolnári, Rábahídvég, Sárfimizdó, Szemenye, Telekes, Vasvár
161.;Veszprém;Ajka;Ajka,  Csehbánya, ,Farkasgyepű, Halimba,  Kislőd,  Magyarpolány, Nyirád,  Öcs, Pula, Szőc,  Úrkút, Városlőd
162.;;Balatonfüred;Alsóörs, Aszófő, Balatonakali, Balatonalmádi, Balatonfőkajár, Balatonfűzfő, Balatonkenese, Balatoncsicsó, Balatonfüred, Balatonszepezd, Balatonszőlős, Balatonudvari, Balatonvilágos, Barnag, Csopak, Dörgicse, Lovas, Monoszló, Óbudavár, Örvényes, Paloznak, Pécsely, Szentantalfa, Szentjakabfa, Tagyon, Tihany, Vászoly, Vöröstó, Zánka
163.;;Pápa;"Adásztevel,  Bakonyjákó, Bakonykoppány, Bakonypölöske, Bakonyság, Bakonyszentiván, Bakonyszücs, 
Bakonytamási, Béb, Békás, Csót,  Dáka, Döbrönte,  Egyházaskesző, Ganna, Gecse, Gic, Homokbödöge, Kemeneshőgyész, Kemenesszentpéter, Kup, Külsővat, Lovászpatona, Magyargencs, Malomsok, Marcalgergelyi, Marcaltő, Mezőlak, Mihályháza, Nagyacsád,  Nagydém, Nagygyimót, Nagytevel, Nemesgörzsöny, Nemesszalók, Németbánya, Nóráp, Nyárád, 
Pápa, Pápadereske, Pápakovácsi, Pápasalamon, Pápateszér, Takácsi, Ugod, Vanyola, Várkesző, Vaszar, Vinár"
164.;;Sümeg;Bazsi, Bodorfa, Csabrendek, Dabronc, Gógánfa, Gyepükaján, Hetyefő, Hosztót,  Káptalanfa,    Megyer, Nemeshany, Rigács, Sümeg, Sümegprága, Szentimrefalva, Ukk, Veszprémgalsa, Zalaerdőd, Zalagyömörő, Zalameggyes, Zalaszegvár
165.;;Tapolca;"Ábrahámhegy, Badacsonytomaj, Badacsonytördemic, Balatonederics, Balatonhenye, Balatonrendes, Gyulakeszi, Hegyesd, Hegymagas,
Kapolcs, Káptalantóti,Kékkút, Kisapáti,Kővágóörs, Köveskál, Lesencefalu, Lesenceistvánd, Lesencetomaj, Mindszentkálla, Monostorapáti, Nemesgulács, Nemesvita, Raposka, Révfülöp, Salföld, Sáska, Szentbékkálla, Szigliget, Taliándörögd, Tapolca, Uzsa, Vigántpetend, Zalahaláp"
166.;;Várpalota;Berhida, Csajág, Jásd, Küngös, Ősi, Öskü, Papkeszi, Pétfürdő, Tés, Várpalota
167.;;Veszprém;Bánd, Felsőörs, Hajmáskér, Hárskút, Herend, Hidegkút, Királyszentistván, Litér, Márkó, Mencshely, Nagyvázsony, Nemesvámos, Sóly, Szentgál, Szentkirályszabadja, Tótvázsony, Veszprém, Veszprémfajsz,Vilonya
168.;;Zirc;Bakonybél, Bakonynána, Bakonyoszlop, Bakonyszentkirály, Borzavár, Csesznek, Csetény, Dudar, Eplény, Lókút, Nagyesztergár, Olaszfalu, Pénzesgyőr, Porva, Szápár, Zirc
169.;;Devecser; Adorjánháza, Apácatorna, Borszörcsök,Csögle, Dabrony, Devecser,Doba, Egeralja,Iszkáz, Kamond,Karakószörcsök, Kerta,Kisberzseny, Kiscsősz, Kispirit, Kisszőlős, Kolontár,Nagyalásony, Nagypirit, Noszlop,Oroszi, Pusztamiske, Somlójenő,Somlószőlős, Somlóvásárhely,Somlóvecse,Tüskevár, Vid
170.;Zala;Keszthely;Alsópáhok, Balatongyörök, Bókaháza, Cserszegtomaj, Dióskál, Egeraracsa, Esztergályhorváti, Felsőpáhok, Gétye, Gyenesdiás, Hévíz, Karmacs, Keszthely, Nemesbük, Pacsa, Rezi, Sármellék, Szentgyörgyvár, Szentpéterúr, Vállus, Várvölgy, Vindornyafok, Vindornyalak, Vindornyaszőlős, Vonyarcvashegy, Zalaapáti, Zalacsány, Zalaigrice, Zalaköveskút, Zalaszabar, Zalaszántó, Zalaszentmárton, Zalavár
171.;;Lenti;"Alsószenterzsébet, Baglad, Barlahida, Belsősárd, Bödeháza, Csertalakos, Csesztreg, Csömödér, Dobri, Felsőszenterzsébet
Gáborjánháza, Gosztolam, Gutorfölde, Hernyék, Iklódbördőce, Kálócfa, Kányavár, Kerkabarabás, Kerkafalva, Kerkakutas, Kerkateskánd, Kissziget, Kozmadombja, Külsősárd, Lendvadedes, Lendvajakabfa, Lenti, Lovászi, Magyarföld, Márokföld, Mikekarácsonyfa, Nemesnép, Nova, Ortaháza, Páka, Pórszombat, Pördefölde, Pusztaapáti, Ramocsa, Rédics, Resznek, Szécsisziget, Szentgyörgyvölgy, Szentpéterfölde, Szijártóháza, Szilvágy, Tormafölde, Tornyiszentmiklós, Zalabaksa, Zalaszombatfa, Zebecke"
172.;;Letenye;Bánokszentgyörgy, Bázakerettye, Becsehely, Borsfa, Bucsuta, Csörnyeföld, Kerkaszentkirály, Kiscsehi, Kistolmács, Lasztonya, Letenye, Lispeszentadorján, Maróc, Molnári, Murarátka, Muraszemenye, Oltárc, Pusztamagyaród, Semjénháza, Szentliszló, Szentmargitfalva, Tótszentmárton, Tótszerdahely, Valkonya, Várfölde, Zajk
173.;;Nagykanizsa;Alsórajk, Balatonmagyaród, Belezna, Bocska, Börzönce, Csapi, Eszteregnye, Felsőrajk, Fityeház, Fűzvölgy, Galambok, Garabonc, Gelse, Gelsesziget, Hahót, Homokkomárom, Hosszúvölgy, Kacorlak, Kerecseny, Kilimán, Kisrécse, Liszó, Magyarszentmiklós, Magyarszerdahely, Miháld, Murakeresztúr, Nagybakónak, Nagykanizsa, Nagyrada, Nagyrécse, Nemespátró, Orosztony, Pat, Petrivente, Pölöskefő, Pötréte, Rigyác, Sand, Sormás, Surd, Szepetnek, Újudvar, Zalakaros, Zalakomár, Zalamerenye, Zalasárszeg, Zalaszentbalázs, Zalaszentjakab, Zalaújlak
174.;;Zalaegerszeg;Alibánfa, Almásháza, Alsónemesapáti, Babosdöbréte, Bagod, Bak, Baktüttös, Becsvölgye, Bezeréd, Bocfölde, Boncodfölde, Böde, Búcsúszentlászló, Csatár, Csonkahegyhát, Csöde, Dobronhegy, Egervár, Gellénháza, Gombosszeg, Gősfa, Gyűrűs, Hagyárosbörönd, Hottó, Iborfia, Kávás, Kemendollár, Keménfa, Kisbucsa, Kiskutas, Kispáli, Kustánszeg, Lakhegy, Lickóvadamos, Ligetfalva, Milejszeg, Misefa, Nagykapornak, Nagykutas, Nagylengyel, Nagypáli, Nemesapáti, Nemeshetés, Nemesrádó, Nemessándorháza, Nemesszentandrás, Németfalu, Orbányosfa, Ormándlak, Ozmánbük, Padár, Pálfiszeg, Pethőhenye, Petrikeresztúr, Pókaszepetk, Pölöske, Pusztaederics, Pusztaszentlászló, Salomvár, Sárhida, Söjtör, Szentkozmadombja, Teskánd, Tilaj, Tófej, Vasboldogasszony, Vaspör, Vöckönd, Zalaboldogfa, Zalacséb, Zalaegerszeg, Zalaháshágy, Zalaistvánd, Zalalövő, Zalaszentgyörgy, Zalaszentiván, Zalaszentlőrinc, Zalaszentmihály, Zalatárnok
175.;;Zalaszentgrót;Batyk, Döbröce, Dötk, Kallósd, Kehidakustány, Kisgörbő, Kisvásárhely, Mihályfa, Nagygörbő, Óhíd, Pakod, Sénye, Sümegcsehi, Szalapa, Tekenye, Türje, Zalabér, Zalaszentgrót, Zalaszentlászló, Zalavég
;;;
;;;
